partida_codigo,cantidad,peso_kg_unitario,fob_usd_unitario,descripcion_producto,profit_percentage_linea
8517.12.00.00,10,0.180,150.00,"Teléfono Móvil Súper Modelo X1",25
8471.30.00.00,5,1.500,450.00,"Laptop Pro Avanzada 14 pulgadas",30
6203.42.90.00,50,0.450,12.50,"Pantalón de Algodón Hombre T-M Azul Marino",
4901.99.90.00,100,0.250,8.00,"Libro: PHP para Expertos en Importaciones",15
9503.00.99.00,20,0.300,5.75,"Juguete Didáctico Bloques de Construcción Eco",35
2208.30.00.00,12,1.200,25.00,"Whisky Escocés Reserva Especial 12 Años",40
